<?xml version="1.0"?> 
<!DOCTYPE vegPlot SYSTEM "vegPlot2001cv.dtd"> 
<vegPlot> 
 
<project> 
	<projectName>Voyager-tnc</projectName> 
	<projectDescription>to map the Yosemite forest</projectDescription> 
	<projectContributor>null</projectContributor> 

	<plot> 
		<authorPlotCode>YOSE.98K37ARTIFICIAL</authorPlotCode> 
		<plotShape>null</plotShape> 
		<slopeGradient>16 </slopeGradient> 
		<slopeAspect>E </slopeAspect> 
		<surfGeo>-999.25 </surfGeo> 
		<hydrologicRegime>-999.25 </hydrologicRegime> 
		<topoPosition>lowslope</topoPosition> 
		<soilDrainage>rapidly drained </soilDrainage> 
		<elevationValue>7286 </elevationValue> 
		<origLat>null</origLat> 
		<origLong>null</origLong> 
		<plotSize>null</plotSize> 
		<state>California</state> 
		<xCoord>313510.00</xCoord> 
		<yCoord>4200221.00</yCoord> 
		<coordType>zone11</coordType> 

		<plotObservation> 
			<soilDepth>0.00</soilDepth> 
			<soilType>-999.25</soilType> 
			<percentRockGravel>0 </percentRockGravel> 
			<authorObsCode>YOSE.98K377_21_98#0000000</authorObsCode> 
			<perSmallRx>6</perSmallRx> 
			<perSand>3</perSand> 
			<perLitter>1</perLitter> 
			<perWood>5</perWood> 
			<perBareSoil>85</perBareSoil> 
			<leafPhenology>evergreen</leafPhenology> 
			<leafType>Microphyllous</leafType> 
			<physioClass>null</physioClass> 

 
			<strata> 
				<strataName>t1</strataName> 
				<strataHeight>-999.25</strataHeight> 
				<strataCover>0</strataCover> 
			</strata> 
 
			<strata> 
				<strataName>t2</strataName> 
				<strataHeight>-999.25</strataHeight> 
				<strataCover>0</strataCover> 
			</strata> 
 
			<strata> 
				<strataName>t3</strataName> 
				<strataHeight>-999.25</strataHeight> 
				<strataCover>0</strataCover> 
			</strata> 
 
			<strata> 
				<strataName>s1</strataName> 
				<strataHeight>-999.25</strataHeight> 
				<strataCover>0</strataCover> 
			</strata> 
 
			<strata> 
				<strataName>s2</strataName> 
				<strataHeight>0.5 - 1 m</strataHeight> 
				<strataCover>20</strataCover> 
			</strata> 
 
			<strata> 
				<strataName>h</strataName> 
				<strataHeight>0.5 - 1 m</strataHeight> 
				<strataCover>5</strataCover> 
			</strata> 
 
			<strata> 
				<strataName>n</strataName> 
				<strataHeight>-999.25</strataHeight> 
				<strataCover>0</strataCover> 
			</strata> 
 
			<strata> 
				<strataName>v</strataName> 
				<strataHeight>-999.25</strataHeight> 
				<strataCover>0</strataCover> 
			</strata> 
 
			<strata> 
				<strataName>e</strataName> 
				<strataHeight>-999.25</strataHeight> 
				<strataCover>0</strataCover> 
			</strata> 
 
			<communityAssignment> 
				<communityName>-999.25</communityName> 
				<CEGLCode>-999.25</CEGLCode> 
			</communityAssignment> 
 
			<taxonObservation> 
				<authNameId>Artemisia tridentata Nutt.</authNameId> 
				<originalAuthority>-999.25</originalAuthority> 
				<strataComposition> 
					<strataType>S3</strataType> 
					<percentCover>62.50</percentCover> 
				</strataComposition> 
			</taxonObservation> 
 
			<taxonObservation> 
				<authNameId>Chrysothamnus viscidiflorus (Hook.) Nutt.</authNameId> 
				<originalAuthority>-999.25</originalAuthority> 
				<strataComposition> 
					<strataType>S3</strataType> 
					<percentCover>2.50</percentCover> 
				</strataComposition> 
			</taxonObservation> 
 
			<taxonObservation> 
				<authNameId>Leptodactylon pungens (Torr.) Torr. ex Nutt.</authNameId> 
				<originalAuthority>-999.25</originalAuthority> 
				<strataComposition> 
					<strataType>S3</strataType> 
					<percentCover>0.50</percentCover> 
				</strataComposition> 
			</taxonObservation> 
 
			<taxonObservation> 
				<authNameId>Purshia tridentata (Pursh) DC.</authNameId> 
				<originalAuthority>-999.25</originalAuthority> 
				<strataComposition> 
					<strataType>S2</strataType> 
					<percentCover>2.50</percentCover> 
				</strataComposition> 
			</taxonObservation> 
 
			<taxonObservation> 
				<authNameId>Prunus andersonii Gray</authNameId> 
				<originalAuthority>-999.25</originalAuthority> 
				<strataComposition> 
					<strataType>S3</strataType> 
					<percentCover>0.50</percentCover> 
				</strataComposition> 
			</taxonObservation> 
 
			<taxonObservation> 
				<authNameId>Hesperostipa comata (Trin.  Rupr.) Barkworth</authNameId> 
				<originalAuthority>-999.25</originalAuthority> 
				<strataComposition> 
					<strataType>H</strataType> 
					<percentCover>2.50</percentCover> 
				</strataComposition> 
			</taxonObservation> 
 
			<taxonObservation> 
				<authNameId>Achnatherum hymenoides (Roemer  J.A. Schultes) Barkworth</authNameId> 
				<originalAuthority>-999.25</originalAuthority> 
				<strataComposition> 
					<strataType>H</strataType> 
					<percentCover>2.50</percentCover> 
				</strataComposition> 
			</taxonObservation> 
 
			<taxonObservation> 
				<authNameId>Gayophytum diffusum Torr.  Gray</authNameId> 
				<originalAuthority>-999.25</originalAuthority> 
				<strataComposition> 
					<strataType>H</strataType> 
					<percentCover>2.50</percentCover> 
				</strataComposition> 
			</taxonObservation> 
 
			<taxonObservation> 
				<authNameId>Elymus elymoides (Raf.) Swezey</authNameId> 
				<originalAuthority>-999.25</originalAuthority> 
				<strataComposition> 
					<strataType>H</strataType> 
					<percentCover>0.50</percentCover> 
				</strataComposition> 
			</taxonObservation> 
 
			<taxonObservation> 
				<authNameId>Achnatherum speciosum (Trin.  Rupr.) Barkworth</authNameId> 
				<originalAuthority>-999.25</originalAuthority> 
				<strataComposition> 
					<strataType>H</strataType> 
					<percentCover>2.50</percentCover> 
				</strataComposition> 
			</taxonObservation> 
 
			<taxonObservation> 
				<authNameId>Eriastrum wilcoxii (A. Nels.) Mason</authNameId> 
				<originalAuthority>-999.25</originalAuthority> 
				<strataComposition> 
					<strataType>H</strataType> 
					<percentCover>0.50</percentCover> 
				</strataComposition> 
			</taxonObservation> 
 
			<taxonObservation> 
				<authNameId>Phacelia bicolor Torr. ex S. Wats.</authNameId> 
				<originalAuthority>-999.25</originalAuthority> 
				<strataComposition> 
					<strataType>H</strataType> 
					<percentCover>0.50</percentCover> 
				</strataComposition> 
			</taxonObservation> 
 
			<taxonObservation> 
				<authNameId>Eriogonum davidsonii Greene</authNameId> 
				<originalAuthority>-999.25</originalAuthority> 
				<strataComposition> 
					<strataType>H</strataType> 
					<percentCover>0.50</percentCover> 
				</strataComposition> 
			</taxonObservation> 
 
			<taxonObservation> 
				<authNameId>Bromus tectorum L.</authNameId> 
				<originalAuthority>-999.25</originalAuthority> 
				<strataComposition> 
					<strataType>H</strataType> 
					<percentCover>0.50</percentCover> 
				</strataComposition> 
			</taxonObservation> 
 
			<taxonObservation> 
				<authNameId>Mentzelia congesta Nutt. ex Torr.  Gray</authNameId> 
				<originalAuthority>-999.25</originalAuthority> 
				<strataComposition> 
					<strataType>H</strataType> 
					<percentCover>2.50</percentCover> 
				</strataComposition> 
			</taxonObservation> 
 
			<taxonObservation> 
				<authNameId>Leucophysalis nana (Gray) Averett</authNameId> 
				<originalAuthority>-999.25</originalAuthority> 
				<strataComposition> 
					<strataType>H</strataType> 
					<percentCover>0.50</percentCover> 
				</strataComposition> 
			</taxonObservation> 
 
			<taxonObservation> 
				<authNameId>Stephanomeria exigua Nutt.</authNameId> 
				<originalAuthority>-999.25</originalAuthority> 
				<strataComposition> 
					<strataType>H</strataType> 
					<percentCover>0.50</percentCover> 
				</strataComposition> 
			</taxonObservation> 
 
			<taxonObservation> 
				<authNameId>Taraxacum officinale G.H. Weber ex Wiggers</authNameId> 
				<originalAuthority>-999.25</originalAuthority> 
				<strataComposition> 
					<strataType>H</strataType> 
					<percentCover>0.50</percentCover> 
				</strataComposition> 
			</taxonObservation> 
 
			<taxonObservation> 
				<authNameId>Ericameria nauseosa ssp. nauseosa var. nauseosa</authNameId> 
				<originalAuthority>-999.25</originalAuthority> 
				<strataComposition> 
					<strataType>S2</strataType> 
					<percentCover>0.50</percentCover> 
				</strataComposition> 
			</taxonObservation> 
 
			<taxonObservation> 
				<authNameId>Phacelia ramosissima Dougl. ex Lehm.</authNameId> 
				<originalAuthority>-999.25</originalAuthority> 
				<strataComposition> 
					<strataType>H</strataType> 
					<percentCover>0.50</percentCover> 
				</strataComposition> 
			</taxonObservation> 
		</plotObservation> 

	</plot> 

	</project> 

 
</vegPlot> 

